### ISSUE TITLE
Incorrect marshalling of XDR data for NFS mkdir and create file operations

### ISSUE THREAD

**Issue by hickeng** [vmware/vic#6500]
Impact:
Prevents volume store creation from succeeding on some NFS servers (Linux seems to tolerate the trailing data)

Details:
XDR serialization is incorrectly including optional data from discriminated union as described here: https://tools.ietf.org/html/rfc1813#page-27

**Comment by hickeng** [comment]
Provided after the fact for reference.

Used the netapp simulator as the target NFS server, deployed in Workstation, with a braindead NFSv3 share configured.
Used the go-nfs-client test binary for diagnosics: `go build -o nfstest ./vendor/github.com/vmware/go-nfs-client/nfs/example/test`
Used `tcpdump` to compare a correct NFS mkdir request via Linux VFS mount and the incorrect request from the Go client (simple packet capture between client and netapp simulator: `sudo tcpdump -i ens32 -w nfs-mkdir.pcap host 192.168.78.20 and 192.168.78.215`)

Correct request processed via wireshark:
```
Frame 4: 230 bytes on wire (1840 bits), 230 bytes captured (1840 bits)
Ethernet II, Src: Vmware_67:1c:b5 (00:0c:29:67:1c:b5), Dst: Vmware_b9:25:d0 (00:0c:29:b9:25:d0)
Internet Protocol Version 4, Src: 192.168.78.215, Dst: 192.168.78.20
Transmission Control Protocol, Src Port: 715, Dst Port: 2049, Seq: 129, Ack: 125, Len: 164
Remote Procedure Call, Type:Call XID:0xb4a9fe0c
    Fragment header: Last fragment, 160 bytes
    XID: 0xb4a9fe0c (3031039500)
    Message Type: Call (0)
    RPC Version: 2
    Program: NFS (100003)
    Program Version: 3
    Procedure: MKDIR (9)
    [The reply to this request is in frame 5]
    Credentials
        Flavor: AUTH_UNIX (1)
        Length: 32
        Stamp: 0x010e6d41
        Machine Name: devbox
            length: 6
            contents: devbox
            fill bytes: opaque data
        UID: 0
        GID: 0
        Auxiliary GIDs (1) [0]
            GID: 0
    Verifier
        Flavor: AUTH_NULL (0)
        Length: 0
Network File System, MKDIR Call DH: 0x707bb260/test5
    [Program Version: 3]
    [V3 Procedure: MKDIR (9)]
    where
        dir
            length: 44
            [hash (CRC-32): 0x707bb260]
            FileHandle: 00000000196ace80000000004000000047251900196ace80...
        Name: test5
            length: 5
            contents: test5
            fill bytes: opaque data
    attributes
        mode: value follows
            set_it: value follows (1)
            Mode: 0755, S_IRUSR, S_IWUSR, S_IXUSR, S_IRGRP, S_IXGRP, S_IROTH, S_IXOTH
        uid: no value
        gid: no value
        size: no value
        atime: don't change
        mtime: don't change
```

Incorrect request - I do not have a reference for this, however it was showing an additional trailing `Data` section in the NFS portion of the request, and mutated depending on values set in the `attributes` section.

**Comment by hickeng** [comment]
There is a confirmed (although not thoroughly vetted) fix in this branch: https://github.com/hickeng/vic/tree/nfs-fix
It needs to be split into a PR for the vmware/go-nfs-client  project and the relatively minor logging improves from vmware/vic direct.

**Comment by hickeng** [comment]
https://github.com/vmware/go-nfs-client/pull/2 opened to fix these problems - the client is still very incomplete, but the targeted tests pass vs both Linux kernel server and NetApp simulator.

**Comment by mdubya66** [comment]
putting into 1.3 and marking high pri, per @pdaigle

**Comment by hickeng** [comment]
Moved back to in-progress to follow up on:
- [ ] default values for `uid`, `gid` and `proto`
- [ ] addition of testing to automated suite
